{
  "schemaVersion": "autoloop.review-findings/v1",
  "jobId": "autoloop-auth1-tc1.g0001",
  "lineageId": "autoloop-auth1-tc1",
  "generation": 1,
  "candidateIdentity": {
    "changedTreeIdentity": "91d53c2b45745e21616f0eff4850a445f1d6e928a7c74fccf48ced4ae6ae1da3",
    "patchSha256": "eb4b85f654dfcc1d66dd0c1d9ca7d90f49a962ca5a8c69e7916e50ce760bcf32",
    "currentHead": "a06124c8d919757c1a6371daaae89ab14546c9ef",
    "baseHead": "7cde0ba0fdd9f66db0dfbe82bb5945fc9bb9ca60",
    "repository": "xonogesrs/autoloop",
    "branch": "governance/auth1-production-retrieval-authority"
  },
  "specIdentity": {
    "specId": "autoloop-auth1-tc1",
    "specDigest": "ee9025ff17f0568e87980a3a9e02f7946523cb2f8b0a7195361ce3d4a6b3bd1f"
  },
  "reviewerIdentity": "controller",
  "findings": [
    {
      "findingId": "TC1-F1",
      "severity": "INFO",
      "subject": "Successor generation implemented and adversarially verified",
      "description": "createSuccessorReviewJob (review-job.mjs) creates g0002 from a legal predecessor via SUPERSEDE + atomic current-pointer converge. Invariants proven by test/governance/test-successor-generation.mjs (9/9): g0001 artifacts preserved; monotonic generation; same lineage; concurrent creation fail-closed (REVIEW_JOB_SUPERSEEDED_BY_OTHER); crash-resume; idempotent re-invocation; stale ACCEPTED can never re-satisfy enforcement; successor runs full lifecycle to fresh ACCEPTED.",
      "recommendedDisposition": "Proceed"
    },
    {
      "findingId": "TC1-F2",
      "severity": "INFO",
      "subject": "Terminal review ordering contract documented; currentHead binding preserved",
      "description": "R-TC1-01 formalized: terminal ACCEPTED review MUST bind the final local commit HEAD. candidateIdentity.currentHead binding NOT removed/weakened — the transition proof (AUTH1-TA1) demonstrated it is the protective mechanism. Documented in card spec + docs/governance/autoloop-auth1-tc1-ordering-contract.md + review-artifact-gate.mjs header.",
      "recommendedDisposition": "Proceed"
    },
    {
      "findingId": "TC1-F3",
      "severity": "INFO",
      "subject": "checkpoint_commit semantics classified and grants freeze order defined",
      "description": "checkpoint_commit.allowed is a prerequisite of BOTH commit classes (checkpoint gate + integration attestation composes it). AUTH1 provisional commit dc51b4a is NOT governance-authorized (plain git commit); TC1 is rebuilt onto stable main@7cde0ba and committed via gov-commit-checkpoint --apply with the gate footer. TC1 authority frozen: base/base_head=7cde0ba, checkpoint_commit.allowed=true, feature_branch_push/draft_pr=false.",
      "recommendedDisposition": "Proceed"
    },
    {
      "findingId": "TC1-F4",
      "severity": "INFO",
      "subject": "No regression in review-job machinery",
      "description": "successor-generation + review-artifact-gate + review-job lifecycle/writeback suites: 55/55 pass on clean baseline; full governance suite 391/393 with 2 pre-existing environment-dependent failures (real-repo package.json clean + timing cascade), verified identical on baseline.",
      "recommendedDisposition": "Proceed"
    }
  ],
  "summary": "TC1 terminal review: successor generation + terminal ordering foundation verified against final commit HEAD a06124c8. No BLOCKER/MAJOR findings.",
  "createdAt": "2026-08-16T07:39:41.641Z"
}
