{
  "schemaVersion": "autoloop.review-findings/v1",
  "jobId": "autoloop-auth1.g0001",
  "lineageId": "autoloop-auth1",
  "generation": 1,
  "candidateIdentity": {
    "changedTreeIdentity": "bd289d6778746ae7af184c5f5f1f2ece03bf260352cfbec2d774ff05c5d523dd",
    "patchSha256": "fee3aa969b9f3cfda82e5346cab9bb9fd47376019b7dbd58253d0f386362d8b9",
    "currentHead": "7cde0ba0fdd9f66db0dfbe82bb5945fc9bb9ca60",
    "baseHead": "7cde0ba0fdd9f66db0dfbe82bb5945fc9bb9ca60",
    "repository": "xonogesrs/autoloop",
    "branch": "governance/auth1-production-retrieval-authority"
  },
  "specIdentity": {
    "specId": "autoloop-auth1",
    "specDigest": "7e17e5a909740db5fa234378f419120b7e019ed6bc6453f2408e3ae52c8381dd"
  },
  "reviewerIdentity": "controller",
  "findings": [
    {
      "findingId": "AUTH1-F1",
      "severity": "INFO",
      "subject": "Frozen candidate identity re-derived and unchanged",
      "description": "buildChangeInventory via deriveReviewJobContext yields changedTreeIdentity=bd289d6778746ae7af184c5f5f1f2ece03bf260352cfbec2d774ff05c5d523dd, patchSha256=fee3aa969b9f3cfda82e5346cab9bb9fd47376019b7dbd58253d0f386362d8b9, currentHead=baseHead=7cde0ba0fdd9f66db0dfbe82bb5945fc9bb9ca60, branch=governance/auth1-production-retrieval-authority. 16 changed paths (0 committed + 13 dirty + 3 untracked candidate). No drift from the AB0 bootstrap freeze.",
      "recommendedDisposition": "Proceed"
    },
    {
      "findingId": "AUTH1-F2",
      "severity": "INFO",
      "subject": "R-09 production entrypoint authority holds",
      "description": "runAutoLoop / runDurableAutoLoop / resumeAutoLoop are unconditionally fail-closed dead-ends (HOLD/throw NON_PRODUCTION_ENTRYPOINT); the internal engine is reachable only via the *Internal harness surface (src/v2/stack-a-internal.mjs). No caller boolean/string/context can unlock the legacy surfaces. Covered by test/test-autoloop-entrypoint.mjs (18/18 pass post-rebind).",
      "recommendedDisposition": "Proceed"
    },
    {
      "findingId": "AUTH1-F3",
      "severity": "INFO",
      "subject": "R-10 retrieval authority predicate is single-owner and fail-closed",
      "description": "isRetrievalAuthorized(admission) requires admission.memory_policy.retrieval_allowed === true (strict boolean). Missing memory_policy / missing retrieval_allowed / false / truthy non-boolean all DENY. Provider availability is never authority. No duplicate authority owner; no direct retrieval bypass. Covered by test/admission/test-retrieval-authority.mjs.",
      "recommendedDisposition": "Proceed"
    },
    {
      "findingId": "AUTH1-F4",
      "severity": "INFO",
      "subject": "Candidate scope matches the frozen AUTH1 mutation set",
      "description": "Authorized paths are exactly the 16-path minimal set (15 code/test + 1 spec). Generated governance artifacts (authority.json, review-job/findings/verdict) are correctly EXCLUDED by the candidate-domain policy. No unrelated workstream (p1-auth1 / rb2 / CBM) in scope.",
      "recommendedDisposition": "Proceed"
    }
  ],
  "summary": "AUTH1-TA1 independent review: R-09/R-10 contract invariants verified against the frozen candidate (changedTreeIdentity=bd289d67..., specDigest=7e17e5a9...). No BLOCKER/MAJOR findings.",
  "createdAt": "2026-08-16T07:02:31.844Z"
}
